(food#neutral),(food#neutral),This food is asian-air fusion.
(food#positive)(price#positive),(food#positive)(price#positive),Nothing fancy but really good food with pretty reasonable price.
(The chicken pot pie#positive)(cheeseburger#positive)(service#positive),(food#positive)(service#positive),"The chicken pot pie is excpetiona, the cheeseburger huge and delictable, and the service professional wan warm."
(food#positive)(ambience#positive),(food#conflict)(ambience#conflict),"While I quite liked the food and the ambience, I'm not quite sure if it they really deserve it the Michelin rating they have displayed so prooudly in the window."
,(anecdotes/miscellaneous#positive),i'm surprised about some of the bad reviews posted here - i've been to tamarind about 5 or 6 times and always come away extremely satisfied and looking forward to returning.
,(anecdotes/miscellaneous#neutral),"But on a lazy Saturday night, we ended up going."
(employees#conflict),(service#conflict),There are a few Italian employees who may not speak the best English but for me that adds to the experience.
,(anecdotes/miscellaneous#neutral),"I have never eaten in the restaurant, however, upon reading the reviews I got take out last week."
(dinner#neutral)(brunch#neutral),(anecdotes/miscellaneous#neutral),Once for dinner and once for brunch.
,(anecdotes/miscellaneous#positive),"I've been to at Cafe Spice probably 5-8 times, it is probably still the best Indian restaurant around Union Square."
(prices#negative),(price#negative),Not worth the prices.
,(anecdotes/miscellaneous#positive),Would recommend - perfect for those looking for a place close to grand central.
(staff#positive),(service#positive),From the moment you enter till the moment you walk out the friendly and helpful staff was was just Fantastic.
(Service#positive)(food#positive),(food#positive)(service#positive),Service was good and food is wonderful.
,(anecdotes/miscellaneous#neutral),I only have friends.
(service#positive),(service#positive),She gets 10 for her excellent service and advice.
(meal#positive),(ambience#conflict)(food#positive),The restaurant is a bit noisy but that is something that can be overlooked once you sit down and enjoy a great meal
(spicy ethnic foods#positive),(food#positive),"being a fan of spicy ethnic foods, indian included, i made friends with this place long ago."
,(anecdotes/miscellaneous#negative),Please save yourself the frustration.
(dinner#negative)(snacking#neutral),(ambience#conflict),And I say snacking because it really is not set up to be a proper dinner.
(quality of food#positive)(live jazz#positive),(food#positive)(ambience#positive),The quality of food at this restaurant accompanied  by fantastic live jazz makes this place a perfect 10!
(food#positive),(food#positive)(anecdotes/miscellaneous#neutral),"I have eaten at Saul, many times, the food is always consistently, outrageously good."
(SEASONAL beer#positive)(bartender#neutral),(food#positive),(Always ask the bartender for the SEASONAL beer!!!
(ambiance#positive),(ambience#positive),"If your visiting, you'll enjoy the ambiance and the fact that it's in Time Sq..."
(food#neutral),(anecdotes/miscellaneous#neutral),"We were on our way back to NJ, and since I am in NY, we figured why not grab some food?"
(sandwiches#conflict),(price#positive),sandwiches tho pricey are over stuffed - can serve 2 persons easily thus cost effective!
,(anecdotes/miscellaneous#neutral),And comparing it to the Chinatown restaurants is simply not fair.
(Service#neutral)(food#neutral),(food#neutral)(service#neutral),Service and food is what any one would expect when spending that type of money.
(atmosphere#positive),(ambience#positive),LOVE the atmosphere - felt like I was in Paris.
(course#positive),(food#positive),Every course was better than the next.
,(price#conflict),"Not cheap, but not that expensive either."
(staff#positive),(service#positive),The staff is incredibly helpful and attentive.
(service#positive),(service#positive),"If presentation and service is your thing, then this magic show works."
(cook#positive),(food#positive),"Apparently, the good cook works then."
,(anecdotes/miscellaneous#positive),I was pleasantly suprised.
(Yellowtail#positive),(food#positive),The Yellowtail was particularly good as well.
,(anecdotes/miscellaneous#neutral),One less manhattanite the better.
,(service#positive),Everyone is welcomed in as family.
(clams oreganta#positive)(salad with perfectly marinated cucumbers and tomatoes with lots of shrimp and basil#positive),(food#positive),I ate clams oreganta and spectacular salad with perfectly marinated cucumbers and tomatoes with lots of shrimp and basil.
(menu#negative)(portions#negative)(lentil dish#negative)(basmati rice dish#negative)(flavor#negative),(food#negative),"The menu changed, portions were even smaller than before, a lentil dish was salty beyond edibility, a basmati rice dish lacked flavor."
(menu#positive),(ambience#positive)(price#positive),"Spice is sleek, modern and cool with a menu that will not hurt your wallet."
(cigar bar#positive)(staff#positive),(service#positive)(ambience#positive),Patroon features a nice cigar bar and has great staff.
,(anecdotes/miscellaneous#neutral),"Hey, I think $2+ for a 5 block walk ain't bad."
(ambient#positive),(ambience#positive)(price#positive),Very affordable and excellent ambient!
,(anecdotes/miscellaneous#negative),Look elsewhere.
(sushi#positive),(food#positive),"More important, the sushi rivals the best in Tokyo."
(cheescake#positive),(food#positive),I have never had cheescake like this.
(Bill#conflict),(price#conflict),"Bill a little high, but worth it."
,(anecdotes/miscellaneous#negative),"I seriously doubt I will ever dine at Jimmy's Bronx, or for that matter, Jimmy's Uptown, again."
,(anecdotes/miscellaneous#positive),Everyone I bring here always loves it.
(delivery#negative),(service#negative),"My co-workers had to wait almost an hour for delivery, only to discover that what they got was not what they ordered."
,(anecdotes/miscellaneous#positive),Worth a visit.
,(anecdotes/miscellaneous#negative),A real dissapointment.
(entertaining#positive),(ambience#positive),Its a go-to for dates as well as entertaining out of town guests.
(ambience#negative),(ambience#negative),Why do people rave about the ambience.
(drink#neutral),(anecdotes/miscellaneous#neutral),Were meeting up with some friends for a drink at Lafayette 161 and happened to walk by Thai Angel famished.
(Fluke sashimi#positive)(jalapeno-lime olive oil#positive)(fruit of the oil#positive)(fish#positive),(food#positive),"Fluke sashimi drizzled with jalapeno-lime olive oil, the fruit of the oil nicely highlighting the fish's sweetness."
(sushi#positive),(food#positive),Great sushi experience.
(meal#positive)(price#positive),(food#positive)(price#positive),"If you're looking for a great meal at a decent price, go to Del Frisco's!"
(rice#negative),(price#negative),They charge $6.00 for rice.
(steak au poivre#negative),(food#negative),My steak au poivre was one of the worst I've had.
,(anecdotes/miscellaneous#positive),"On a recent Sunday afternoon, a friend and I accidently found this great restaurant on our way to see the pulitzer prize winning play DOUBT."
(staff#positive)(ambiance#positive)(owner#positive),(ambience#positive),The owner and staff are all Japanese as well and that adds to the entire ambiance.
(congee#positive)(bread#positive)(donut like deep fried dough they call Ow Ley Soh#positive),(food#positive),"Try the congee and the donut like deep fried dough they call Ow Ley Soh, a delicious and sweet tasting bread."
(candle-light#positive)(food-quality#positive)(service#positive)(tables#negative),(food#positive)(service#positive)(ambience#conflict),"Although the tables may be closely situated, the candle-light, food-quality and service overcompensate."
(food#positive)(waiter#positive),(food#positive)(service#positive),The food was delicious and the waiter was incredibly helpful and attentive (considering we were the only ones there for the first hour).
(caviar#positive)(waitstaff#positive),(food#positive)(service#positive),"From the spectacular caviar to the hospitable waitstaff, I felt like royalty and enjoyed every second of it."
,(anecdotes/miscellaneous#positive),I will be going back and heartily recommend it!
,(anecdotes/miscellaneous#positive),Would definitely visit again.
,(anecdotes/miscellaneous#positive),Definitely worth the trip to Battery Park City!
(food#conflict)(ethnic food#negative),(food#conflict),"Perhaps this food is considered extreme to an Upper East Side resident, but for the rest of us who've actually eaten ethnic food, this is simply dull."
(place#negative),(ambience#conflict),The place was real empty but that was because this was the first Sunday they ever opened.
(food#positive)(money#positive)(place#conflict),(price#positive)(ambience#conflict),This little place definitely exceeded my expectations and you sure get a lot of food for your money.
(Ambience#positive)(service#positive),(service#positive)(ambience#positive),"Ambience is delightful, service impeccable."
(Service#positive)(AC#positive),(service#positive)(ambience#positive),"Service was excellent, and the AC worked very well too (thank God, it was hot!)."
,(food#positive)(price#negative),Tasty but expensive.
(people#positive),(service#positive),You get the sense that the people there care about their restaurant and about your experience and that is very nice.
(cooks#positive),(food#positive)(service#positive),"Both are delicious, the cooks are friendly and are willing to take a moment and speak to you and shake your hand."
,(anecdotes/miscellaneous#neutral),so i thought why not change it up a bit.
(sushi rolls#positive),(food#positive),My friend ordered some of their special sushi rolls which had excellent presentation and tasted great!
(prices#neutral)(dinner menu to sit#neutral)(take out#neutral),(price#neutral),Although be warned their dinner menu to sit and take out prices are different.
(staff#positive)(food#positive)(place#positive),(food#positive)(service#positive)(ambience#positive),"The staff was accomodating, the food was absolutely delicious and the place is lovely."
,(anecdotes/miscellaneous#neutral),P.S. Please don't tell anyone in my family i eat there.
(Scallion Pancake#positive)(vegetable juice#positive)(Guizhou Chicken#positive)(Shredded Squid Family Style#positive)(Sichuan Spicy Soft Shell Crab#positive)(Shuizhu Fish#positive)(Sichuan food#neutral),(food#positive),"my picks are:  - Scallion Pancake (fried with vegetable juice, very special and tasty)  - Guizhou Chicken  - Shredded Squid Family Style (one of my personal favorites)  - Sichuan Spicy Soft Shell Crab  - Shuizhu Fish (this one is for hardcore Sichuan food fans, I wouldn't recommend to my American friends as it's very spicy."
(spinach mushroom calzone#negative)(canned vegetables#negative),(food#negative),They smell like they stuff them with old canned vegetables like the spinach mushroom calzone.
(food#neutral),(anecdotes/miscellaneous#neutral),"To celebrate a birthday, three of us went to Mare anticipating great food."
(Blue Point oysters#neutral)(beer#neutral)(glass of wine#neutral),(price#positive),There was a great deal for 6 Blue Point oysters and a beer or glass of wine for $8!
(noodle dishes#positive)(Green Curry dish#negative),(food#conflict),I really liked the noodle dishes at Rice Avenue compared to their Green Curry dish.
,(anecdotes/miscellaneous#positive),"I went to pams with my girlfriend, and i love it."
(prices#negative),(price#negative),"But for whatever reason, prices are about twice as high."
(service#negative)(food#negative),(anecdotes/miscellaneous#neutral)(service#negative)(price#negative)(food#negative),I am relatively new to the area and tried Pick a bgel on 2nd and was disappointed with the service and I thought the food was overated and on the pricey side.
(atmoshere#positive),(ambience#positive),Great atmoshere and worth every bit.
,(anecdotes/miscellaneous#negative),We had a most unpleasant experience at this restaurant.
(spicy tuna roll#positive)(rock shrimp tempura#positive)(appetizer#positive),(food#positive),"The spicy tuna roll was unusually good and the rock shrimp tempura was awesome, great appetizer to share!"
(staff#positive),(service#positive),The staff was knowledgeable and full of personality.
(staff#positive),(service#positive),Great staff.
(cost#negative)(meal#neutral)(seat#negative),(service#negative)(price#negative),"Only complaint would be that at an average cost of $12-$15 per meal, I'd like not to have to worry about finding a seat!"
(dessert#positive)(White Chocolate Bread Pudding with Gelato and hot chocolate#positive)(dinner#positive),(food#positive),"To finish off such a delightful dinner experience you must have dessert, especially the White Chocolate Bread Pudding with Gelato and hot chocolate."
(banana tower#positive)(dessert#positive),(food#positive),The banana tower is an amazing dessert as well.
,(anecdotes/miscellaneous#neutral),I went there with my friend last saturday.
(atmosphere#positive)(dishes#positive)(service#positive),(food#positive)(service#positive)(ambience#positive),"Excellent atmosphere, delicious dishes good and friendly service."
(place#positive)(drinks#positive)(desserts#positive),(food#positive)(ambience#positive),A cool place to hang with your friends for a couple of healthy drinks and desserts.
(vibe#positive),(ambience#positive),"Great vibe, lots of people."
(food#positive)(food#positive),(food#conflict),"I like Mamoun's food as well, but side by side, Kati Rolls just produce tastier food hands down."
,(anecdotes/miscellaneous#neutral),Just an odd group.
(service#negative)(dinner#neutral)(table#positive),(service#conflict),"The service is a bit slow, but harkens back to my years growing up in Napoli, Italy where things are not rushed and when you sit down for dinner the table is yours all night."
,(ambience#negative),"Either that, or the editor's idea of romance must be sharing a conversation with the next table, while trying to speak louder than the traffic on 57th."
,(anecdotes/miscellaneous#positive),I love this place!
,(anecdotes/miscellaneous#negative),it is not consistent.
(icing on the cake#negative)(tiramisu#negative),(food#negative),But that wasn't the icing on the cake: a tiramisu that resembled nothing I have ever had.
(food#positive)(prices#positive),(food#positive)(price#positive),Great food and the prices are very reasonable.
(Wine list#conflict),(food#conflict),Wine list is not huge but def well selected.
(bar#positive)(food#positive)(beer#positive),(food#positive)(ambience#positive),"A cool bar with great food, and tons of excellent beer."
(specials#positive),(food#positive),"Be sure to try the seasonal, and always delicious, specials."
(ambience#positive)(service#positive),(ambience#positive)(service#positive),The ambience is authentic and relaxing and we have always received attentive and prompt service.
(french cuisine#positive)(portions#positive),(food#positive),"Fresh, authentic, french cuisine in substantial portions."
(Drinks#negative),(service#negative),"Drinks got screwed up, she acted put upon."
(vegetarian entree#positive)(Abby's treasure#positive)(wintermelon#positive)(assortment of fresh mushrooms and vegetables#positive),(food#positive),The one vegetarian entree (Abby's treasure) was actually quite a surprise - it was delicious and had wintermelon covering an assortment of fresh mushrooms and vegetables.
(dumplings#positive),(price#positive),"At 5 dumplings for $1, you just cannot go wrong."
(pizza#negative),(price#negative),But the pizza is way to expensive.
(staff#positive),(service#positive),"And the staff is also young, energeic and hot!!!!"
(Steak au Poivre#positive)(Onglet#positive),(food#positive),"Even better, they know how to cook French classics like Steak au Poivre and Onglet without burning it to death or overcooking it."
(Service#conflict)(prices#negative)(reputation#positive),(service#conflict),"Service was decent, but not as smooth as I would expect from a place with these prices and reputation."
(meal#positive),(food#positive),We had a wonderful meal at Naples 45 a month ago on a visit to NYC.
(drink#positive),(food#positive),Good drink.
(food#positive)(spinach and corn dumplings#positive)(service#positive)(bathroom#positive)(massamman curry#positive),(food#positive)(service#positive)(ambience#positive),"Great food (spinach and corn dumplings and massamman curry), very friendly and no nonsense service and a clean and funky bathroom."
,(anecdotes/miscellaneous#neutral),Was there Friday night.
(dinner#neutral),(anecdotes/miscellaneous#neutral),We had a girls' night dinner here for restaurant week.
,(ambience#positive),Romantic if you want it to be (brightly lit).
(ceiling#negative)(dinner#neutral),(anecdotes/miscellaneous#negative),"However, I was there for a work dinner not long ago when my colleague from London noticed a very large waterbug on the ceiling."
,(anecdotes/miscellaneous#positive),I recommend it!
,(anecdotes/miscellaneous#positive),I have taken practically every guest that has come to visit me in NY and hooked a few New Yorkers onto Peep as well.
,(anecdotes/miscellaneous#neutral),enough said!
,(anecdotes/miscellaneous#neutral),I don't live in NY but my best friend does.
(chow fun and chow see#negative),(food#negative),My chow fun and chow see was really bland and oily.
(table#positive)(reservation#positive)(seated#positive),(anecdotes/miscellaneous#positive)(ambience#positive),"Even though I made the reservation at 3pm for the same night through Dinnerbroker, we were seated at a table with one of the best view!"
(pita#negative)(naan#negative),(service#negative),"we did notice however, that some tables had what looked like pita instead of naan."
(menu#neutral)(oysters#positive),(food#positive),"I didn't take a look at the rest menu, but the oysters were fantastic."
,(anecdotes/miscellaneous#neutral),After the review I treked into Brooklyn.
(grilled cheese#positive),(food#negative),The grilled cheese at home afterwards was better.!!
,(service#positive),We were pleasantly greeted.
(doors#conflict),(ambience#negative),The red sliding doors may be unique but they do not block off the cold air from the outside.
(service#positive)(food#positive),(food#positive)(service#positive),"Great service, great food."
(food#conflict),(price#negative)(food#positive),"The food is expensive, but worth every bite."
(food#negative)(service#negative)(service#negative)(good#positive),(food#conflict)(service#negative),"sometimes i get bad food and bad service, sometimes i get good good and bad service."
(waitress#negative)(check#neutral),(service#negative)(anecdotes/miscellaneous#negative),When we were finally seated our waitress came by twice-1 for our order and 2-for our check.
(terrace#positive),(ambience#positive),In summer-eat outside on a terrace (another great feature of Suan)!!!
(design#positive)(drinks#positive)(food#positive)(bar#neutral),(food#positive)(ambience#positive),"It's the perfect restaurant for NY life style, it got cool design, awsome drinks and food and lot's of good looking people eating and hanging at the pink bar..."
,(anecdotes/miscellaneous#neutral),"Recommendations, of course, are required!"
(bar#neutral),(service#negative),We did have to wait at the bar for approx.
,(anecdotes/miscellaneous#neutral),You fellas above says its the best Taiwanese restaurant in town.
,(anecdotes/miscellaneous#positive),"Yeah, it's that good."
(seafood#positive)(place#positive),(food#positive),"If you love seafood, you would love this place!"
(service#positive),(service#positive),"Good, fast service."
,(food#positive)(price#positive),Dakshin is one of the few affordable and tasty Indian restaurant in the upper east side.
(prices#negative),(price#negative),They charge different prices all the time.
,(ambience#conflict),"To dine at Thalia can be slightly deceiving because while its beautiful on the outside, its so bland on the inside."
(service#negative),(anecdotes/miscellaneous#positive)(service#negative)(price#negative),"I was in love with Pongsri on 48th, but compared to Suan it is slow in service and overpriced."
(cheese#positive)(menu#positive),(food#positive)(anecdotes/miscellaneous#positive),"My friends and I experienced amazing cheese and a delicious, new summer menu at Artisanal last night."
,(anecdotes/miscellaneous#positive),"I am so coming back here again, as much as I can."
,(anecdotes/miscellaneous#positive),I have been going back again and again.
(atmoshere#positive),(ambience#positive),"It's charmingly small and that leads to an atmoshere that is extremely cozy and romantic, even."
(Japanese cuisine#negative),(food#negative),It is obvious that no one in the restaurant has any idea about or experience with Japanese cuisine.
(food#neutral)(appetizers#neutral),(food#neutral),"In terms of the food itself -- nothing special, we limited ourselves to several appetizers."
(Jazz bands#positive),(ambience#positive),Love the Jazz bands on Fri and Sat.
,(anecdotes/miscellaneous#positive),"Overall, excellent restaurant!"
(hostess#positive)(wait#negative)(table#positive),(service#conflict),"To begin, we were told there was a 30 minute wait and started to leave, when the hostess offered to call us on our cell phone when the table was ready."
(servers#positive),(service#positive),The servers give you some sample slices of your order while you wait (shortly I might add).
(service#neutral),(service#neutral),The service was ok.
(dish#neutral),(service#negative)(anecdotes/miscellaneous#negative),"When asked about how a certain dish was prepared in comparison to a similar at other thai restaurants, he replied this is not Mcdonald's, every place makes things differently While it is understandable that every place is indeed different, there was not a need to be uncourteous to customers and downright rude."
,(anecdotes/miscellaneous#positive),I ate here for the first time and absolutely loved it!
(tables#negative),(ambience#negative),"Don't expect to sit down inside though, there are only a few tables and they are always full."
(staff#positive)(ambiance#positive)(food#positive),(food#positive)(service#positive)(ambience#positive),"The staff is accomodating, the ambiance is exciting and yet relaxed, and the food is out of this world!"
(food#positive)(halibut special#positive)(steak#positive)(service#positive),(food#positive)(service#positive),"The food was delicious (I had a halibut special, my husband had steak), and the service was top-notch."
(manager#negative)(bill#neutral),(service#negative),The manager claimed that he could not compensate us for anything on the bill which just shows the lack of sophistication from the entire group.
,(anecdotes/miscellaneous#positive),This is by far my favorite place in the neighborhood.
,(anecdotes/miscellaneous#negative),But too far east!
,(anecdotes/miscellaneous#positive),Satisfying.
,(anecdotes/miscellaneous#positive),Highly Highly Highly recommended!
(japanese comfort food#positive),(food#positive),it's the only place you can get yummy authentic japanese comfort food.
(half price sushi deal#positive),(price#positive),We took advanatage of the half price sushi deal on saturday so it was well worth it.
(reservation#neutral)(seated#positive),(service#positive),we came here on a crowded saturday night and were seated right away despite being 15 minutes late for our reservation.
,(ambience#positive),"This place is cool enough to be in the East Village, but French enough to make you feel like you could be in a bistro in a back alley in Paris."
(appetizer platter#neutral),(anecdotes/miscellaneous#neutral),We were fast to order the appetizer platter since we were very hungry.
(staff#positive),(service#positive),"The staff are attentive, and have smiles on their faces."
,(food#positive),This is the BEST Shabu-Shabu Restaurant in the Try-State Area.
(dress codes#positive)(attitudes#positive)(place#positive),(ambience#positive),"No dress codes, no attitudes, plenty of comfort companionship, a great place to relax in an always busy Midtown."
(pieces of sushi#positive),(food#positive),"Largest and freshest pieces of sushi, and delicious!"
(pasta#positive),(food#positive),Even the pasta is delicious here (a rarity in New York pizza restaurants).
(menu#negative)(dumplings#neutral)(appetizer#negative),(food#negative),"but when we looked at the menu, there weren't a lot of choices, most of them were dumplings in the appetizer section."
(jewish deli food#conflict),(anecdotes/miscellaneous#conflict)(service#negative)(food#conflict),"Maybe I say so because it looked promising for people who like artery-clogging jewish deli food, but turns out to be poorly run and awful."
(manager#positive),(service#positive),After my 3rd time the manager remembered me and treated me like an usual customer.
,(anecdotes/miscellaneous#positive),This place is greatly welcome in the desolate little strip between the Prospect Expressway and Greenwood Cemetery - a wasteland we like to call The Sliv.
(toaster#negative),(anecdotes/miscellaneous#negative),now if they could only get a toaster.
,(anecdotes/miscellaneous#positive),You will find yourself returning quite often.
(Neapolitan pizza#positive)(zucchini blossoms#positive),(service#positive)(food#positive),"When he's not making authentic Neapolitan pizza in the open brick oven or lightly frying zucchini blossoms, he's visiting the regulars (a growing legion) and checking on newcomers."
(Wait staff#negative)(pie#positive),(food#positive)(service#negative),Wait staff is blantently unappreciative of your business but its the best pie on the UWS!
