(outdoor atmosphere#positive),(ambience#positive),The outdoor atmosphere of sitting on the sidewalk watching the world go by 50 feet away on 6th avenue on a cool evening was wonderful.
(toppings#neutral),(price#negative),"A large is $20, and toppings are about $3 each."
,(anecdotes/miscellaneous#positive),"In any event, this is a place I'll be sure to stop by again when I'm in this part of town."
,(anecdotes/miscellaneous#negative),I definitely wouldn't go back.
,(price#negative),It is not worth for that bucks.
(pizza#positive),(anecdotes/miscellaneous#positive),brick oven gallery is My pick for best pizza restaurant anywhere.
(service#positive)(food#positive)(price#positive),(food#positive)(price#positive)(service#positive),Add to that great service and great food at a reasonable price and you have yourself the beginning of a great evening.
(Thai food#negative),(food#negative),"For many people, this may not seem like Aunthentic Thai food because most places in NYC arent quite authentic."
(bagels#neutral),(anecdotes/miscellaneous#neutral),"Growing up in NY, I have eaten my share of bagels."
(bills#negative),(price#negative),"Oh, don't even let me start with how expensive the bills were!"
,(anecdotes/miscellaneous#positive),A hearty two thumbs up!
(scallion pancakes#neutral)(fried dumplings#neutral),(food#neutral),The scallion pancakes and fried dumplings were nothing out of the ordinary.
(appetizers#positive)(salads#positive)(steak#positive)(pasta#positive),(food#positive),"All the appetizers and salads were fabulous, the steak was mouth watering and the pasta was delicious!!!"
(table#negative)(served#negative)(dishes#negative)(table#negative)(served#negative)(bill#negative),(service#negative)(price#negative),"Besides having the table we had been promised given to other restaurant patrons twice before we were actually seated, we were served dishes we hadn't ordered three times, received one of our orders 20 minutes after the rest of the table had been served (and that order was undercooked), and charged $45 more than we should have been on our bill."
(Service#positive),(service#positive),Service is top notch.
(food#negative),(food#negative),The food now is inconsistent.
,(anecdotes/miscellaneous#positive),All pretty good.
(dumpling#positive),(anecdotes/miscellaneous#positive),"You can also special order any kind of dumpling,etc."
,(anecdotes/miscellaneous#positive),you guys rock.
,(anecdotes/miscellaneous#negative),Chance is a joke.
(fondue appetizer#neutral),(food#positive)(anecdotes/miscellaneous#positive),I was pretty much full after our fondue appetizer.
(spice#neutral),(food#neutral),BE CAREFUL before you request extra spice.
(Octopus salad#positive),(food#positive),The octopus eaters were floored by the Octopus salad.
(foods#negative)(MSG cooking#negative),(food#negative),We thought that this place is using too much of MSG cooking in the foods.
,(anecdotes/miscellaneous#neutral),I was at Rao's last Wed.
(Tom Kha soup#negative),(food#negative),And the Tom Kha soup was pathetic.
(Bombay beer#positive),(food#positive),I started out with a Bombay beer which was big enough for two.
(decor#positive)(dining hall#positive)(semi-private boths#positive),(ambience#positive),"The decor is vibrant and eye-pleasing with several semi-private boths on the right side of the dining hall, which are great for a date."
(Service#positive),(service#positive),Service was quick.
,(anecdotes/miscellaneous#negative),Tends to turn people away.
,(anecdotes/miscellaneous#neutral),We thought this a prelude to what the evening will be like.
,(anecdotes/miscellaneous#positive),"I was turned on to this restaurant by a fellow foodie friend of mine, and have been going back regularly ever since."
(service#negative),(service#negative),Drawbacks: service is slow and they don't toast!
(office lunch#neutral),(anecdotes/miscellaneous#neutral),Went there for an office lunch.
,(anecdotes/miscellaneous#positive),I have been doing all of the above at the Heartland Brewery for over 5 years now and I HAVE NEVER BEEN DISAPPOINTED!
,(anecdotes/miscellaneous#conflict),"Everytime I decide to try another place on the UES, I get angry that I didn't just go to Zucchero Pomodori."
(sweet lassi#positive)(lamb chettinad#positive)(garlic naan#positive)(rasamalai#negative),(food#conflict),The sweet lassi was excellent as was the lamb chettinad and the garlic naan but the rasamalai was forgettable.
(bistro fare#positive)(chef#positive)(food#positive),(food#positive),"We've been following chef Lyle's food around New York for 15 years and while remaining classic, his innovations with bistro fare have made us return and return."
(lambchops#positive),(food#positive),The best thing I tasted were the lambchops.
,(food#positive),it's delicious!
(spicy tuna#positive)(salmon#positive),(food#positive),The spicy tuna and salmon are the best we've ever had.
(seafood#positive)(prices#negative),(food#positive)(price#negative),"Even though its good seafood, the prices are too high."
(food#positive)(prices#positive),(food#positive)(price#positive),"In addition, the food is very good and the prices are reasonable."
(owners#positive)(hosts#positive),(service#positive),"Upon entering, we were greeted by the owners, Steven and Frederick, who went out of their way to be more than gracious hosts."
,(anecdotes/miscellaneous#negative),"If you live outside the neighborhood, don't bother!"
(quality value#negative),(anecdotes/miscellaneous#negative),Been going here since it opened have seen the quality value decrease considerably.
(Meat dishes#neutral)(vegetarian-friendly choices#positive),(food#neutral),"Meat dishes now adorn the selections, although there's still a large number of vegetarian-friendly choices."
,(anecdotes/miscellaneous#positive),I never had anything I didn't like here.
(prices#positive),(price#positive),Reasonable prices.
(amuse bouche#positive)(dessert#positive)(tables#positive)(service#positive),(service#positive),they bring service up a notch by offerng complementary amuse bouche to all tables and gave us a small dessert for our celebration.
(crunchy tuna#positive),(food#positive),"Try the crunchy tuna, it is to die for."
(food#negative),(food#negative)(price#conflict),It won't break the bank but I also wouldnt come back for the food.
(sushi#positive),(anecdotes/miscellaneous#positive),"All in all, this midtown gem instantly became one of my favorite sushi restaurants in the city."
,(anecdotes/miscellaneous#negative),I've been to Joya twice and I will never go again.
,(anecdotes/miscellaneous#negative),So rushing us out was absolutely unnecessary!
,(anecdotes/miscellaneous#neutral),However it is the ONLY Taiwanese restaurant in town.
(live entertainment#positive)(special effects#positive),(ambience#positive),It is a lot of fun with live entertainment and all kinds of Disney type special effects.
(sushi#positive)(sushi#positive),(food#positive),"if you're looking for perfect traditional sushi, go here - if you're looking for interesting combinations, try sushi of gari's (east side)."
(fountain drinks#negative),(food#negative),"No refills on fountain drinks, though."
(beers#positive),(food#positive),Wow over 100 beers to choose from.
(portions#positive),(food#positive),Be careful of portions - they're HUGE.
(Steak Tartare#positive),(food#positive),"The Steak Tartare is a great bet, they fix it for you at the table."
(Crab Croquette apt#negative),(service#positive)(food#negative),My first time there I happened not to like the Crab Croquette apt that i ordered and they were happy to change it for me without making no big deal.
(waiter#positive),(service#positive)(anecdotes/miscellaneous#positive),Great for large groups and celebrations - our SUPER HAPPY waiter was the entertainment of the evening.
(wine#neutral),(food#neutral),Did I mention the wine?
(house wine#positive),(food#positive),"Plus, on Wednesday nights the house wine is unlimited!"
,(anecdotes/miscellaneous#positive),It is by far my favorite restaurant in Brooklyn.
,(ambience#negative),Now it's so crowded and loud you can't even talk to the person next to you.
,(anecdotes/miscellaneous#positive),Love Pizza 33..
,(food#positive),Even my Indian friend couldn't believe how good and tasty everything was.
,(anecdotes/miscellaneous#positive),"I'm from England, and Haru's was the best I had in NYC."
,(anecdotes/miscellaneous#positive),Less = More in their case.
,(anecdotes/miscellaneous#negative),Ruby Foo's is a tourist trap.
,(anecdotes/miscellaneous#negative),I've been here a couple of times and have not been impressed.
,(anecdotes/miscellaneous#positive),I've been many time and have never been disappointed.
,(anecdotes/miscellaneous#neutral),Ciao Bella
(bread#negative),(food#negative)(service#negative),like saying her bread comes from a special bakery when we have seen her buying it dowtown manhathan.
(dim sum servings#neutral),(food#neutral),The dim sum servings here are a bit larger than I'm used to.
(management#neutral)(door#positive)(glass front#negative),(service#neutral)(ambience#negative),"However, in the summer of 2003, it seems the management has changed and the great big door has been replaced for a glass front ridding itself of the dark romantic getup."
(meal#negative),(food#negative),We won't go to this place again for a good meal.
,(ambience#neutral),It's a much more grown up restaurant compared to the rest of the street.
(Barbecued codfish#positive)(seasoning#negative)(texture#conflict)(spice rub#negative)(herb mix#negative)(sauce#negative),(food#conflict),"Barbecued codfish was gorgeously moist - as if poached - yet the fabulous texture was let down by curiously bland seasoning - a spice rub might have overwhelmed, however herb mix or other sauce would have done much to enhance."
,(service#negative),We were treated with attitude ever since the moment we stepped into the restaurant!
(dance floor#positive)(dinner#neutral),(ambience#positive),"After dinner, take your date to the HUGE dance floor, probably one of the biggest you'll see in NY."
(value#positive)(food#positive),(food#positive)(price#positive),Taj Mahal offeres gret value and great food.
(chef#neutral)(owner#neutral),(service#neutral),Has the chef and owner changed???
(dinner#positive),(anecdotes/miscellaneous#positive),My boyfriend and I recently had an early dinner at Artisanal and was satisfied with our experience.
,(anecdotes/miscellaneous#positive),I absolutely Loved this place.
,(anecdotes/miscellaneous#positive),I wish I lived there as I would eat at this place as often as possible!
(bacon#negative)(platter#negative)(in sandwiches#negative)(frying#negative)(bacos#negative),(food#negative),"But don't ever order bacon late at nite (either platter or in sandwiches, for that matter don't from any take out place) as it is from the morning frying turns out hard almost like bacos, hurt my molars."
(Bagels#positive),(food#positive)(price#negative),"Outstanding Bagels, but you get what you pay for."
(Pizza#positive)(crust#positive)(pizza#positive)(toppings#neutral)(bread#positive),(food#positive),"Pizza - the only pizza in NYC that should not have additional toppings - the crust tastes like the best, freshly baked bread!"
,(anecdotes/miscellaneous#negative),"If you're in town, it's worth searching for another place."
,(anecdotes/miscellaneous#positive),I have tried the various slice joints around the village but this is by far the best one.
(spot#positive),(ambience#positive),"I found it on a cold night, the perfect spot to warm up."
(menu#negative)(American Chinese food#negative),(food#negative),They even have a section in the menu called American Chinese food!
(Service#positive)(beef carpaachio#positive)(pasta#positive)(portion#positive),(food#positive)(service#positive),"Service was warm and attentive, beef carpaachio was exellent (huge portion) and pasta was fresh and well-prepared."
(kalbi#neutral)(nebbiolo#neutral),(food#neutral),kalbi and nebbiolo do work together.
(Italian food#positive),(food#positive),"Best Italian food I ever had (and being Italian, that means alot)."
(Italian food#positive),(food#positive),I will recommend Scopa to all of my friends for a place to go for wonderful Italian food.
(Located#positive),(ambience#positive),Located at the end of a magnificent block.
,(price#negative)(anecdotes/miscellaneous#negative),"This restaurant is not worth the time, effort, or money to say the least."
(meal#positive)(room#neutral)(clubhouse#negative),(ambience#positive)(food#positive),"Looking around, I saw a room full of New Yorkers enjoying a real meal in a real restaurant, not a clubhouse of the fabulous trying to be seen."
,(anecdotes/miscellaneous#positive),Keep up the good work guys!
,(anecdotes/miscellaneous#positive),Hurley's is terrific!
(trays of Dim Sum#neutral),(ambience#positive),They don't walk around with the trays of Dim Sum.
,(anecdotes/miscellaneous#neutral),Took my sister here before attending a show one evening.
(bar#positive)(bartenders#positive),(service#positive),"Great bar, most gorgeous bartenders you've ever seen (specifically the blond lady)."
(dessert#neutral)(waitress#negative)(bill#neutral),(service#negative),We were planning to get dessert but the waitress basically through the bill at us before we had a chance to order.
,(anecdotes/miscellaneous#neutral),Really.
(cheff#positive)(food#positive),(food#positive),I really loved the different and inovated touch that's the cheff gives to the food.
,(anecdotes/miscellaneous#neutral),Our friends have not arrived yet.
(cheese#negative),(food#negative),They came out over cooked and the cheese was almost non existant.
(meal#positive)(server#positive)(wine#positive)(wine#negative)(price range#positive)(priced#neutral),(food#positive)(service#positive),"I had a terrific meal, and our server guided us toward a very nice wine in our price range, instead of allowing us to purchase a similarly priced wine that wasn't as good."
(svc#negative),(service#negative)(anecdotes/miscellaneous#positive),"The svc can be a bit rude at times, esp if you have big group, but overall the restaurant is a must!"
,(anecdotes/miscellaneous#positive),"My husband and I thougt it would be great to go to the Jekyll and Hyde Pub for our anniversary, and to our surprise it was fantastic."
,(anecdotes/miscellaneous#conflict),Never once did I leave feeling unwelcome or impressed.
(food#positive)(dishes#positive)(drinks#positive),(food#positive),"The food is good, especially their more basic dishes, and the drinks are delicious."
(whole grilled fish#positive),(food#positive),But the main hit was the whole grilled fish.
(tuna tartare#positive)(sake#positive)(mushroom ravioli#positive)(pinot noir#positive)(chocolate sampler#positive)(dessert wine#positive),(price#positive),"I had the tuna tartare with sake, mushroom ravioli with pinot noir, and the chocolate sampler with a dessert wine for $49."
(lunch#positive),(anecdotes/miscellaneous#positive),On a hot day it was fabulous to stop in and enjoy lunch.
(food#positive)(service#positive),(food#positive)(service#positive),The food is delicious and beautifully prepared along with the friendly and personable service.
(lines#negative)(crowds#negative),(anecdotes/miscellaneous#neutral),I usually go there later at night when I get off work so I don't have to deal with crowds or lines.
(Pizza#positive),(food#positive),Pizza here is consistently good.
(shows#positive)(food#positive)(characters#positive),(food#positive)(ambience#positive),We had a great tiem watching the shows and characters and ar food was just what we were looking for.
(waiter#negative)(beers#neutral)(manager#negative)(reservations#positive),(service#negative),"After 2 tries by the waiter to take it away (we hadn't even looked at it yet, we had full beers yet to drink), the manager approached and told us they needed the table for people with reservations."
(dinner#negative),(anecdotes/miscellaneous#negative),Wouldn't recomend it for dinner!
(Sauce#negative)(food#negative)(flavor#negative),(food#negative),Sauce was watery and the food didn't have much flavor.
(Sangria#positive),(food#positive),My husband and I enjoy Sangria.
(indian cuisine#positive),(food#positive),"But after last night, Spice Grill is the only place I'm eating indian cuisine."
(pasta dish#positive)(served#positive),(service#positive)(food#positive),We both opted for a pasta dish and they were served timely and fresh.
(bread#negative)(appetizer#neutral)(glass of wine#neutral)(main course#neutral),(service#negative),"First the wrong bread came out with the appetizer, then when i tried to order a second glass of wine for my main course..."
(neighborhood#positive)(food#positive),(food#positive)(ambience#positive),"Not sure where the previous reviewer, lonk, dined, but Saul is in a great neighborhood and has great food!"
(Thai food#positive),(food#positive),"In an area sadly lacking in decent Thai food, this is one of the best spots."
(waiter#negative),(anecdotes/miscellaneous#neutral),Tell them Herky sent you and get a free confused look from the waiter.
(hosting staff#negative)(reservations#negative)(reservation#neutral)(seating#negative),(service#conflict),Make reservations but expect to be delayed 15-20 minutes as the hosting staff was having difficulty seating guests who arrived with a reservation because they probably had a lot of walk ins being so close to Time Square.
(food#positive)(dishes#positive),(food#positive),The food was average or above including some surprising tasty dishes.
(specials#negative)(ingredients#negative)(thai#neutral),(food#negative),They don't seem to place an emphasis on specials or fresh ingredients which to me is necessary for good thai.
(apetizers#neutral)(food#neutral),(food#neutral),Other apetizers and food
(noodle and rices dishes#positive),(food#positive),The noodle and rices dishes taste great.
(food#positive),(food#positive),The food's as good as ever.
(crust#positive)(staff#positive)(ingredients#positive),(food#positive)(service#positive),"The crust is thin, the ingredients are fresh and the staff is friendly."
,(anecdotes/miscellaneous#positive),Your friends will thank you for introducing them to this gem!
(bagel#neutral),(price#negative),Also a little more expensive than your average bagel place.
(food#negative)(vegetables#negative)(sauce#negative),(food#negative),"the food was undercooked-the sauce watery, and the vegetables raw."
(fried clams#positive),(food#positive),And the fried clams had just enough kick to them to make 'em worth eating.
(sauces#negative),(food#negative),The sauces used are also not that exciting.
(lunch menu#positive)(appetizer#positive)(entree#positive),(food#positive),The secret is the lunch menu which offers a complimentary appetizer with every entree ordered.
,(anecdotes/miscellaneous#positive),I absolutely love this place!!!
(rice#negative)(quality#negative)(cooked#negative),(food#negative),The rice was poor quality and was cooked so badly it was hard.
(champagne#positive)(caviar#positive),(food#positive),We had champagne and caviar and felt like princesses!
(shrimp scampi#positive)(antipasti#positive),(food#positive),The shrimp scampi was excellent and the antipasti were plentiful.
,(anecdotes/miscellaneous#negative),I am surprised to say the least and find such practice not worth the effort.
(dessert#neutral)(waiter#positive),(service#positive),"When my dessert came, there was a candle in it - not because anyone asked for one - but because the waiter must have seen me opening my birthday card and gift, and said he knew it was a special occassion of some sort."
(dim sum combo#positive),(price#positive)(food#positive),"I got the $10 10-piece dim sum combo, every bite of which was great."
,(anecdotes/miscellaneous#neutral),There are other Vietnamese restaurants in the chinatown area and you can forget about those.
(seating#negative)(food#neutral)(wait#negative),(ambience#negative)(service#negative),There is also very limited seating and there can be a substantial wait in getting food at peak times.
(martini#neutral)(bar#neutral)(Roast Chicken#positive),(food#positive),"If it's just a quick martini at the bar (which I recommend Jeffery's) or a mind blowing Roast Chicken, go to Village!"
,(anecdotes/miscellaneous#negative),No thanks!!!
(table#neutral)(insde table#positive)(wait#negative),(service#conflict),"There was a long wait for a table outside, but it was a little too hot in the sun anyway so our insde table was very nice."
,(anecdotes/miscellaneous#positive),I would definently recommend this restaurant.
(prices#positive),(price#positive),The prices are wonderfully low.
(chicken vindaloo#neutral)(spicy food#neutral),(food#positive),If you like spicy food get the chicken vindaloo.
,(anecdotes/miscellaneous#positive),I lOVE THIS PLACE!
(lunch specials#positive),(food#positive)(price#positive),I have never been disappointed but their true strength lays in their amazingly delicious and cheap lunch specials.
(bar food#positive)(menu#positive)(hand-crafted beers#positive),(food#positive),"So much more than the usual bar food, go there to enjoy the menu while sampling one of their hand-crafted beers."
,(anecdotes/miscellaneous#negative),"A big disappointment, all around."
,(food#positive),And its absolutely DELICIOUS.
(drink#neutral),(price#negative),No free drink.
,(food#conflict),I would say that all was fine and tasty but the heaviness on my stomach someting that i can't not mention or undermine.
(food#positive)(service#positive),(food#positive)(service#positive)(anecdotes/miscellaneous#positive),This is my first time writing a review for a restaurant because the food and service was excellent.
,(anecdotes/miscellaneous#negative),Definitely Highly NOT recommended.
(capex#positive)(bagels#neutral),(food#positive)(price#positive),"While they keep the capex to a minimum, they do put some cash into the bagels, because they among the best in the city."
,(service#positive),I had a huge group for my birthday and we were well taken care of.
(chefs#neutral),(anecdotes/miscellaneous#neutral),The two star chefs left quite some time ago to open their own place.
(decor#neutral),(ambience#positive),Don't waste money on decor.
(back garden#positive)(outdoor seating#positive),(ambience#positive),They also have a back garden open in the summer - cute and French with outdoor seating - what more could you ask for?
,(anecdotes/miscellaneous#positive),"go to any corned indian restaurant, and the little india strip along east 6 st rules supreme!"
(nigiri#neutral),(food#neutral)(anecdotes/miscellaneous#neutral),I have never before eaten 40 pieces of relatively good nigiri.
(architecture#positive)(place#negative),(ambience#conflict),"Given the incredible architecture surrounding it, this place has no character."
(dinner#neutral),(anecdotes/miscellaneous#neutral),I'd call it an 'italian dinner'.
,(anecdotes/miscellaneous#neutral),my first time here was with my gf for our 12 month anniversary.
(drinks#positive)(place#negative),(food#positive)(ambience#negative)(price#positive),"While the place is not a hotspot hangout, the drinks are unique and pack a lot of bang for the buck."
,(anecdotes/miscellaneous#neutral),I have walked by this place for eons and finally went thanks to a girls' night.
(food#positive),(food#positive)(anecdotes/miscellaneous#positive),Have frequented 'ino for several years and the food remains excellent.
(eggplant#positive),(food#positive),"Their eggplant is so delicate, sweet tender!"
,(anecdotes/miscellaneous#positive),I pray it stays open forever.
(food#positive),(food#positive),"Each bite of food at Kai was indeed delicious, fresh, and elegant."
(food#positive)(quality of food#positive)(priced#neutral),(food#positive)(price#positive),all the food was excellent - considering the quality of food in most moderately priced restaurants is mediocre this was slightly more pricey and well worth it.
,(price#negative),"If you want to save some money, don't go here."
(mushroom pizza#positive),(food#positive),My friend got the mushroom pizza which tasted better.
(cod with paella#negative)(fish and chips#negative)(serving#negative)(fish#neutral)(fries#neutral),(food#conflict),"I had the cod with paella (spicy and very filling, I'm a big eater and could only eat half) while my boyfriend had the classic fish and chips (again, a big serving - at least 5 pieces of fish and a basketful of fries)."
(place#positive)(service#negative),(service#negative)(ambience#positive),"It's a shame that a nice, convenient place like the Pink Pony can be so ruined by lousy service."
,(anecdotes/miscellaneous#neutral),This is the first time Citysearch did't call it right.
(calamari#negative),(food#negative),You should pass on the calamari.
(porcini mushroom pasta special#negative)(seafood tagliatelle#negative),(food#negative),"The porcini mushroom pasta special was tasteless, so was the seafood tagliatelle."
(spicy wontons#positive)(salt pepper shrimps#positive),(food#positive),Try the spicy wontons and the salt pepper shrimps.
(FOOD PORTIONS#positive),(food#positive),THE FOOD PORTIONS ARE REALLY LARGE.
(fries#positive),(food#positive),The fries are yummy.
(staff#positive)(bar service#positive),(service#positive),"Friendly and informative staff, very attentive and prompt raw bar service."
(Taiwanese food#positive),(food#positive),Best Taiwanese food in NY!
,(anecdotes/miscellaneous#negative),I have eaten at many pizza places around NYC and this is hands down the worst.
(food#positive),(food#positive),This place is a great stop for great food.
(pastas#positive)(homemade lasagna#positive),(food#positive),All the pastas are fantastic and the homemade lasagna is some of the best that I have had in the City.
,(anecdotes/miscellaneous#neutral),What for?
