(primi#positive)(secondi#positive)(portions#positive),(anecdotes/miscellaneous#positive)(food#positive),"My wife and I will usually only order one primi and one secondi and split them, as they tend to offer large portions."
,(anecdotes/miscellaneous#negative),This restaurant was way overhyped.
(employees#negative)(dining area#neutral),(service#negative)(anecdotes/miscellaneous#negative),I've overheard comments from him to his employees that should not have been delivered in the dining area and I've been sitting there while he lectured another customer.
(crab cakes#positive),(food#positive),Delicious crab cakes too.
,(anecdotes/miscellaneous#positive),"Now at the top of our list, Del Frisco's Steakhouse."
,(anecdotes/miscellaneous#positive),I cannot imagine you not rushing out to eat there.
(dining experience#negative),(anecdotes/miscellaneous#negative),This was the worst dining experience I've ever had.
(service#positive)(staff#positive),(service#positive),I have been coming here for years and have nothing but good things to say about the service and the great staff at La Lanterna.
(waiter#negative),(service#negative),Just bring someone who speaks Cantonese because waiter may not understand you.
,(anecdotes/miscellaneous#positive),I thought I had died and gone to heaven.
,(anecdotes/miscellaneous#neutral),"Not someplace I would seek to try out but if I am in the area again, I will certainly stop by."
(bruschetta#positive)(panini#positive),(food#positive),The bruschetta and panini's are so yummy!
(Food#neutral),(food#neutral),"Food was okay, nothing great."
(waitress#neutral),(anecdotes/miscellaneous#negative),Every waitress and customer who passed by me bumped into my chair.
,(anecdotes/miscellaneous#positive),I have been going there since it opened and I can't get enough.
(wait#negative),(ambience#conflict),"Always popular, always full, always a wait."
,(anecdotes/miscellaneous#positive),"In fact, you can't miss it."
,(anecdotes/miscellaneous#positive),I recently tried Suan and I thought that it was great.
,(ambience#conflict),A little noise but I think that was because of our party!
(Sichuan chef#neutral),(anecdotes/miscellaneous#neutral),It is run by the same Sichuan chef who started the chain in Chinatown.
,(anecdotes/miscellaneous#neutral),Get the feeling they settled into a groove a while ago.
(spicy tuna roll#negative)(serving#neutral)(nori#negative),(food#negative),"If the omakase is to showcase technique and variety, serving almost 40% of items BBQ-ed and a spicy tuna roll wrapped with not-so-fresh nori seems to be a rather limp performance."
(patio#positive),(ambience#positive),"I can't wait for summer, when they serve outside on their gigantic patio."
(Pastrami#positive)(portion#positive),(food#positive),Best Pastrami I ever had and great portion without being ridiculous.
(food#neutral),(food#neutral),"If you are someone who appreciates the same things but hope to have food to spare or share, Kai may not be the best option."
(drinks#positive),(food#positive),go here for the drinks!
,(anecdotes/miscellaneous#negative),"I don't get it, what's so special about Prune ?"
,(anecdotes/miscellaneous#positive),I'd definitely recommend this little place.
,(anecdotes/miscellaneous#positive),"Again, if you are in this neighborhood - by all means, come here."
(courses#positive)(chocolate sampler#negative)(dessert wine#negative),(food#conflict),"The first 2 courses were very good, but the chocolate sampler was too rich for me and the dessert wine far too sweet."
(Butter#negative)(white wine#negative)(cheese#negative),(food#negative),"Butter was melted, white wine warm, cheese oozing everywhere."
(private room#neutral),(service#positive),We had a party in their private room and they made it truly memorable and were very helpful in the planning.
,(anecdotes/miscellaneous#positive),Do yourself a favor and walk the extra avenue from joe's to eat here.
(ambience#negative)(place#negative)(aisle#negative),(ambience#negative),"It cannot be the ambience, because the place is very cramped and some guests have to sit in an aisle."
,(anecdotes/miscellaneous#positive),I have eaten at Shabu Tatsu at least 5 times and I always want to go back for more!
(pre-fixe menu#negative)(choices per course#neutral)(ordering a la carte#negative),(food#negative),We were disappointed with the pre-fixe menu of only 2 choices per course (other restaurants offer 3 choices) and ended up ordering a la carte.
(Pakistani food#positive),(food#positive),Authentic Pakistani food.
(staff#positive)(chef#positive),(service#positive),"The staff has always been friendly without seeming grating, and the chef has greeted us on a couple of occasions."
,(anecdotes/miscellaneous#negative),Get it together.
(eggplant parmesan#positive)(baked ziti with meatsauce#positive)(serves#positive),(food#positive)(anecdotes/miscellaneous#positive),"The eggplant parmesan is also great, and my friend who grew up in Manhattan claims that no one serves a better baked ziti with meatsauce."
(ingredients#positive)(price#positive),(food#positive)(price#positive),"Quality ingredients preparation all around, and a very fair price for NYC."
(Service#positive),(service#positive),"Service was very good - prompt, attentive and non-intrusive."
(hot pot with seafood#negative)(shrimp#negative)(squid#negative)(entree#positive)(crabmeat#negative),(food#negative),"My entree of hot pot with seafood was full of imitation crabmeat with a couple pieces of shrimp and squid, and was unnecessarily heated with a burner."
(cheese fondue#neutral)(kielbasa#neutral)(apples#neutral),(food#neutral),We began with the cheese fondue (the artisanal blend) and added apples and kielbasa to dip.
(value#positive)(lunch#positive),(anecdotes/miscellaneous#positive),"In such a crappy part of town to find a good value for lunch, this place is great."
(curry#neutral)(food#neutral),(food#neutral),"Its not curry in a slurry crap, and regular run of the mill food."
(food#negative)(menu#neutral),(anecdotes/miscellaneous#negative)(food#negative),"In fact, while leaving the place we saw two people looking at the menu, and I couldn't help telling them that the food was horrible."
(table#positive)(seated#positive),(service#positive),"Even though the restaurant was packed, we were seated promptly and even asked for a table upstairs with no problems."
(white sauce#negative)(Chinese food#neutral),(anecdotes/miscellaneous#negative)(food#negative),"If you want Americanized Chinese food with your usual watery, generic white sauce, this is your place."
(bread#positive)(paratha bread#positive)(bread#negative)(stuffing#positive)(tandoori#positive),(food#positive),"The bread is the soft paratha bread (unlike the plain bread they use in Calcutta), and the stuffing is tandoori styled and very flavorful."
(Service#positive)(prices#positive)(delivery time#negative)(pizza#positive),(service#conflict)(price#positive)(food#positive),"Service is friendly, prices are good - delivery time was a little slow, but for the way this pizza tastes, I'm willing to overlook it."
(food#conflict)(food#positive)(price#positive)(food#positive)(food#neutral)(food#negative),(food#positive)(price#conflict),The food can get pricey but the prixe fixe tasting menu is the greatest food for a good price and they cater the food to any food allergies or food you don't like.
(service#positive)(decor#positive)(food#positive)(portions#positive),(food#positive)(service#positive)(ambience#positive),"The service is excellent, the decor is great, and the food is delicious and comes in large portions."
,(anecdotes/miscellaneous#positive)(ambience#positive),A word to the wise - the Hoboken health inspector clued me to his findings that this is THE cleanest restaurant in town.
(service#positive),(service#positive),An excellent service
(food#neutral),(food#neutral),"The food however, is what one might expect."
(Thai noodles with shrimp and chicken and coconut juice#positive),(food#positive),I LOVE their Thai noodles with shrimp and chicken and coconut juice is the MUST!
,(anecdotes/miscellaneous#positive),I must give it Yon out of Yon stars!
(pizza#positive),(food#positive),The pizza was really good.
(menu items#negative),(anecdotes/miscellaneous#negative),"The only possible drawback to this last point is that as of the date of this posting, the additional menu items are only written in Chinese."
(Food#neutral),(food#negative),"Food is average, and I would say even the chain restaurant Baluchi's tastes better."
(place#negative)(food#positive),(food#positive)(ambience#negative),The place is small and cramped but the food is fantastic.
(food#positive)(portion sizes#positive),(food#positive),The food is tasty and portion sizes are appropriate.
,(service#positive)(ambience#negative),A little crowded but they move that line really fast!
,(anecdotes/miscellaneous#positive),Enjoy!!!
(Kosher dills#positive)(sandwich#positive),(food#positive),Kosher dills are the perfect compliment for your unforgetable sandwich and they give you plenty of them.
,(anecdotes/miscellaneous#positive),Kudos to Po!
(shows#positive)(dinner#neutral)(entertainment#positive),(ambience#positive),The entertainment was great they have shows that go on through out the dinner.
,(anecdotes/miscellaneous#neutral),My boyfriend and I were in NY for a few days and Pastis was a place that came recommended.
(food#positive)(waiters#positive),(service#positive)(price#positive),The food is so cheap and the waiters are nice.
(food#positive)(wait#negative),(food#positive)(service#negative),The food there is so good that even to order out the wait is incredible.
(bartender#negative),(service#negative),The bartender on my most recent visit was so incredibly rude that I will never go back.
(sushi#positive)(Kamikaze#positive)(Rolls#positive),(food#positive),"Their sushi, Kamikaze and other Rolls are fresh and well presented."
(Thai food#positive),(food#positive),"For authentic Thai food, look no further than Toons."
,(ambience#neutral),"It's true, you feel like your in a scene from Goodfellas."
,(anecdotes/miscellaneous#neutral),I read the other review and have to say I had the opposite experience here last Sunday.
(mayonaisse#negative)(food runners#neutral)(bill#negative)(fries#negative),(food#negative)(price#negative),"The highlight of the night was the mayonaisse for my side of fries I received from one of the food runners, which is not good considering the bill was nearly $100."
(braised lamb shank in red wine#positive)(special#positive),(food#positive),"I choose to go with one of the special, the braised lamb shank in red wine, which was excellent."
(wines#neutral)(wine list#positive),(food#positive),"If anyones has doubt of not knowing enough about wines,please check their wine list."
,(anecdotes/miscellaneous#negative),Never again!
(waitstaff#negative)(food#neutral),(service#negative),"The only concern i have is with the slighly all-business waitstaff who order and throw the food down, rushing you out."
(iced tea#positive),(food#positive),Have the iced tea.
,(anecdotes/miscellaneous#negative),For Park avenue I expected so much more.
(salmon#negative)(chicken#positive)(servings#negative)(entree#negative),(food#conflict),"Small servings for main entree, i had salmon (wasnt impressed) girlfriend had chicken, it was good."
,(anecdotes/miscellaneous#negative),So rude.
(salads#negative)(lettuce#neutral),(food#negative),you can actually get 2 salads worth if u take it home and add it to some lettuce!
(ambience#positive)(place#positive),(ambience#positive),The ambience is very romantic and definitely a good place to bring a date.
,(service#positive),They are FAST.
(bar#positive)(tables#negative)(waiter#neutral)(bartender#neutral)(atmosphere#positive),(ambience#conflict),"It is far more popular as a bar than as a restaurant, with only a few tables and the waiter being the bartender, but we greatly enjoyed the unobtrusive atmosphere."
(food#positive)(price#positive)(fried dumplings#negative),(food#positive)(price#positive),"The food is very good for it's price, better than most fried dumplings I've had."
(prices#negative),(anecdotes/miscellaneous#negative)(price#negative),There are much better places in NY with better prices.
,(ambience#positive),"Very neighborhoody, very quick and sufficient."
(Obv caviar#positive)(menu#positive),(food#positive),Obv caviar is top of the line but the rest of the menu is so diverse it gives you a chance to taste so manydifferent varietys.
(dishes#negative),(food#negative)(price#negative),I ate here a week ago and found most dishes average at best and too expensive.
,(anecdotes/miscellaneous#positive)(food#positive),"Everything is delicious, though, my gf and I come here once a week sometimes- you will get addicted!"
,(ambience#negative),And I could do without the cigar smoke.
(food#neutral)(dining experiences#positive),(anecdotes/miscellaneous#positive),"Still, try it once, since if you end up loving the food, it could be one of your best dining experiences."
(food#neutral),(service#negative),I've waited over one hour for food.
(pizza#positive)(santa fe chopped salad#positive)(fish and chips#positive),(food#positive),"Other guests enjoyed pizza, santa fe chopped salad and fish and chips."
(ambience#positive),(ambience#positive),The ambience is very calm and quiet.
(service#negative),(service#negative),"Both times I was extremely dissappointed by the service, which was boarderline rude."
,(food#negative),Stay away from the latter since you won't go for seconds (hint hint).
(pizza#positive),(food#positive),"not only does make the best pizza in NY , maybe anywhere."
(Tuna roll#positive)(price range#positive),(food#positive)(price#positive),The spicy Tuna roll is huge and probably the best that I've had at this price range.
(Price#negative)(fish#negative)(quality#negative),(food#negative)(price#negative),Price and quality of fish alone will keep us from making a return visit.
(waiter#positive),(service#positive),Our waiter and all of the people helping him were attentive and genuine.
(place#positive)(dishes#positive)(wine#positive)(atmosphere#positive)(served#positive),(food#positive)(service#positive)(ambience#positive),The place is a BISTRO which means: simple dishes and wine served efficiently in a bustling atmosphere.
(comfort food#positive),(food#positive),This is one of the best comfort food places in the city.
(ingredients#positive)(technique#positive)(lunch#neutral)(dinner#neutral),(food#positive)(anecdotes/miscellaneous#positive),"Overall, the ingredients and technique are there and I am encouraged enough to return at lunch or dinner to see whether the boldness of the flavour palette improves."
(pastrami sandwich#positive),(food#positive),I had a huge pastrami sandwich on a roll.
(table#negative)(atomosphere#positive)(room#negative)(spot#negative),(ambience#conflict),"Though you will undoubtedly be seated at a table with what seems like barely enough room (no matter what the size of your party), the warm atomosphere is worth the cramped quarters- you'll have fun and forgot about the tight spot you're in."
(fish#negative)(rice#negative),(food#negative),The fish was not fresh and the rice tasted old and stale.
(price#negative)(dish#negative)(lunch special#negative),(price#negative)(food#negative),"Considering their price of $6.25 for lunch special, the dish was ridiculously small."
(Indian Fast Food#positive),(food#positive),This is the pinnacle of Indian Fast Food (all fast foods in my opinion).
(service#negative)(money#negative)(tip#negative),(service#negative),"Besides, when you have bad service, that's less money you have to tip."
,(anecdotes/miscellaneous#neutral),We do not need to go to a four-star restaurant anymore.
(wine list#positive),(food#positive),The wine list is also really nice.
,(anecdotes/miscellaneous#positive),I thanked my friend who recommended me this restaurant and will certainly recommend it to others.
,(anecdotes/miscellaneous#positive),I plan on stopping by next week as well.
(Service#positive)(oysters#positive)(price#positive),(food#positive)(service#positive)(price#positive),"Service was devine, oysters where a sensual as they come, and the price can't be beat!!!"
(bagel#negative),(food#neutral),"Compared to Ess-a, Tal offers a less doughy bagel!"
(italian food#positive),(food#positive),Ballato's is consistently delicious authentic italian food.
(service#positive),(service#positive),"The service was attentive, yet discreet."
,(anecdotes/miscellaneous#positive),"As a retired hipster, I can say with some degree of certainty that for the last year Lucky Strike has been the best laid-back late night in the city."
(prices#negative)(atmosphere#negative),(ambience#negative)(price#negative),For those prices and the dressed up atmosphere you expect more and should get more.
,(service#negative),"Then, IF they answer the phone, you're lucky if they don't hang up on you!"
(menu#neutral)(drinks#positive),(food#conflict)(price#negative),They offer the same menu but have creative drinks that are loaded with alcohol and cheeky names -- but they do cost you.
(atmosphere#positive)(food#positive),(food#positive)(anecdotes/miscellaneous#positive)(ambience#positive),We went to eat at the Jekyll and Hyde restaurant on Friday night and really enjoyed the fun atmosphere and good food.
(food#positive)(portions#positive),(food#positive),The food was pretty tradional but it was hot and good with large portions.
,(anecdotes/miscellaneous#positive),Highly recommended to all!
,(anecdotes/miscellaneous#positive),highly recommended.
(place#negative)(place#negative),(anecdotes/miscellaneous#negative),"Unless you are eating in the Pizzeria side of this place, and are not in a rush, this place is a bad idea."
(service#negative),(service#negative),You have to increase the service a lot.
(Ambiance#negative)(management#positive),(ambience#negative),Ambiance is barely romantic but management tries.
(portions#negative)(appetizers#negative)(appetizer#negative)(main entree#neutral)(cold udon#neutral)(chef#positive)(menu#positive)(dish#negative)(portions#negative),(food#negative),"I must warn the reader that the portions sizes are very small (especially the appetizers), so if you plan to eat until you are full and do not intend to order the chef's special tasting menu, prepare to order and pay for an appetizer (1 dish for each person because the portions are not for sharing), a main entree, and the cold udon at the end of the meal."
(food#negative)(rice#neutral),(service#negative),They were very abrupt with me when I called and actually claimed the food was late because they were out of rice.
(sashimi#neutral)(portions#negative),(food#negative),"After we got our sashimi order, I could not believe how small the portions were!"
(main course#neutral)(waiter#negative),(service#negative),"After the main course came, we didn't see our waiter for at least 40 MINUTES!"
,(anecdotes/miscellaneous#positive),It will be on my to do list the next visit to NYC.
(snapple#positive),(price#positive),Nothing better than buying a snapple for $3.25 too.
(apps#neutral),(service#neutral),"When family came in he gave them apps to test their palets, and then ordered for them."
,(anecdotes/miscellaneous#positive),I was pleasantly surprised to find this gem in Hoboken.
(Service#positive)(decor#positive),(service#positive)(ambience#positive),"Service is extraordinary, yet not overbearing, and the decor brings a taste of trendy SoHo into Queens."
(dosas#negative)(popcorn topping#neutral),(food#negative),"The dosas are skimpy, unattractive and drip with grease, and personally I'd drink popcorn topping before I'd eat another one of these."
(service#positive)(food#positive),(food#positive)(service#positive),The service was excellent and the food was delicious.
(scene#negative)(customers#negative),(anecdotes/miscellaneous#negative)(ambience#negative),If I wanted to deal with a crappy scene and annoying customers I'd go out in Manhattan.
(seafood#neutral),(anecdotes/miscellaneous#neutral),"After a seafood craving, i checked citysearch and chose to go to Fish based on a previous review and the citysearch info."
(ladies#positive),(ambience#positive),Right off the major deegan you get ladies from all over the city.
(wait#negative),(service#negative),Until you realize that their five minutes is meaningless and your wait may be anywhere from two to twenty minutes it may be frustrating.
,(food#positive),always fresh and delicious.
(food#conflict),(food#conflict),"The food was very good, but not very thai."
(people serving#positive)(food#negative),(food#negative)(service#positive),"Thalia is a beautiful restaurant with beautiful people serving you, but the food doesn't quite match up."
(fillings#neutral)(dosa batter#positive),(food#positive),The fillings may be unconventional but the dosa batter is definitely authentic and the combinations very tasty.
(lunch#positive)(dinner#positive)(pre-theatre or after-theatre drinks#positive)(spot#positive),(anecdotes/miscellaneous#positive)(ambience#positive),"This is the perfect spot for meeting friends, having lunch, dinner, pre-theatre or after-theatre drinks!"
,(anecdotes/miscellaneous#positive),This is a fun restaurant to go to.
(mussaman curry#negative)(fried tofu#negative)(potato#negative),(food#negative),"The mussaman curry that I ordered was as thin as water and aside from the poorly fried tofu that I ordered in it, they graciously provided me with ONE piece of poorly cooked potato."
(dinner#neutral),(anecdotes/miscellaneous#neutral),Had a late night dinner on a Saturday night.
(food#positive)(service#positive)(atmosphere#positive),(food#positive)(service#positive)(ambience#positive),A restaurant that doesn't try to do anything except serve great food with great service in a pleasant atmosphere.
(sake martini#positive),(food#positive),Their sake martini is wonderful.
(place#negative),(ambience#negative),"Well, this place is so Ghetto its not even funny."
,(anecdotes/miscellaneous#positive),Bravissimo !!
(Gnochi#neutral),(anecdotes/miscellaneous#positive),Once they ran out of Gnochi and made it for me from scratch!
(dining#positive),(anecdotes/miscellaneous#positive),We would like to thank Marcelo and Grace for a wonderful dining experience!!!
(service#positive),(service#positive)(anecdotes/miscellaneous#positive),"Found service above average, but that could be because we were 13 of us."
,(anecdotes/miscellaneous#positive),"When I arrived at Orsay I was thrown back, in a veyr good sense."
(Bagels#neutral),(food#neutral),"Bagels are ok, but be sure not to make any special requests!"
,(anecdotes/miscellaneous#neutral),"This is the Cheers of New York, whether you've ever been there or not."
,(anecdotes/miscellaneous#positive),It's to die for!
,(ambience#positive),Cute and decorative.
,(ambience#negative),"I know this is the case in many nyc eateries, but here, they really cram you in to the point where it's borderline uncomfortable."
(quality#positive),(food#positive),fine dining restaurant quality.
(price#negative),(anecdotes/miscellaneous#negative)(price#negative),Overall a disappointing experience for that price category.
(lunch buffet#neutral),(anecdotes/miscellaneous#neutral),"I've had the lunch buffet at Chennai a couple of times, when I have been in the neighborhood."
(food#positive),(food#positive),The food was exceptional.
,(anecdotes/miscellaneous#positive),You will be satisfied.
,(anecdotes/miscellaneous#positive),Another great place to take out-of-towners!
,(anecdotes/miscellaneous#neutral),"But, hey, there is anything better with a decent vegetarian selection in Astoria."
,(anecdotes/miscellaneous#negative),We were less than impressed.
(rice#neutral)(dinner#neutral),(anecdotes/miscellaneous#negative),A Thai restaurant out of rice during dinner?
,(anecdotes/miscellaneous#negative),but still my date was bad
,(anecdotes/miscellaneous#positive),Would definitely go back again.
,(anecdotes/miscellaneous#positive),I have been to Rao's probably 15 times the past 3 years and it keeps getting better.
(portions#negative)(food#positive),(food#conflict),The portions are small but being that the food was so good makes up for that.
(serve#positive),(service#positive),(and I have eaten my share) Which impresses me for having such a large amount of people to serve.
(setting#positive),(ambience#positive),"Sure, the setting is nice."
,(anecdotes/miscellaneous#positive),Overall a worthwhile experience.
(service#positive)(food#positive)(prices#conflict),(food#positive)(service#positive)(price#conflict),"The service is friendly, if not the most prompt in the world, the food is great, and the prices, while not cheap, won't put your wallet out of commission."
(appetizer#neutral)(entrees#neutral)(cokes#neutral)(bill#neutral),(food#neutral)(price#neutral),"Had 1 appetizer, 2 entrees and 2 cokes and the bill was ~$55.00, not including tip."
,(anecdotes/miscellaneous#neutral),"It's really a takeaway place, I wouldn't sit if I could take it home."
,(anecdotes/miscellaneous#positive),THE MOST FUN RESTAURANT I HAVE EVER BEEN TOO!
(drumsticks over rice#positive)(sour spicy soup#positive),(food#positive),Best drumsticks over rice and sour spicy soup in town!
,(ambience#positive),Some of the finest latin women you'll see in your life hang out at Jimmy's.
(wines#negative),(food#negative)(price#negative),Slightly above average wines start at $70+ with only one selection listed at $30+.
(whitefish salad#positive)(whitefish#positive)(mayo#positive),(food#positive),Their whitefish salad is excellent--all whitefish with a little mayo.
(price#positive)(congee#neutral)(noodles#neutral)(rice dishes#neutral),(price#positive),"And it all comes at a very reasonable price (congee, noodles, and rice dishes are no more than $3-6 each)."
