(atmosphere#neutral),(ambience)(anecdotes/miscellaneous),Cool atmosphere but such a let down.
(Sashimi portion#positive)(artifical lobster meat#neutral),(food),"The Sashimi portion are big enough to appease most people, but I didn't like the fact they used artifical lobster meat."
(wheat crusted pizza#positive)(ingredients#positive),(food),They have wheat crusted pizza made with really fresh and yummy ingredients.
(dinner#positive)(service#positive),(food)(service),"Had a lovely dinner in this dedicated seafood joint, food was well-prepared and -presented and the service was pleasant and prompt."
(cake#positive),(food),"the icing MADE this cake, it was fluffy, not ultra sweet, creamy and light."
(slices#positive),(price)(service)(anecdotes/miscellaneous),"Finally let into the store 5 at a time, to buy expensive slices from a harried staff."
(wait staff#negative),(service)(anecdotes/miscellaneous),We ended up having to just leave because we were essentially being ignored by the wait staff--even though the rest of the restaurant was largely empty.
(wine list#positive),(food)(price),"The wine list is extensive, well priced and covers alot of regions."
(salads#positive),(food),Go here if you want fresh and tasty salads of any type you can imagine.
(bathroom#positive),(anecdotes/miscellaneous)(ambience),Everything about this place is adorable - even the bathroom!
(food#positive)(prices#positive)(service#positive)(repast#positive),(service)(food)(price),"Speedy delivers, great food, decent prices, and friendly service combine to ensure an enjoyable repast."
(WAITERS#neutral),(anecdotes/miscellaneous),THEY HAVE WAITERS ON THE SIDEWALK TRYING TO PULL YOU IN WHICH MADE US SUSPICIOUS.
(ITALIAN MEAL#positive),(anecdotes/miscellaneous),IT WAS OUR ONLY OPPORTUNITY TO VISIT AND WANTED AN AUTHENTIC ITALIAN MEAL.
(pizza#neutral),(food)(anecdotes/miscellaneous),It took 100 years for Parisi to get around to making pizza (at least I don't think they ever made it before this year)...but it was worth the wait.
(steak#neutral),(food),I asked for a simple medium rare steak.
"(dish#neutral)(organic grilled burgers#positive)(organic grilled burgers#neutral)(dish#neutral)(Jerusalem market-style falafel wraps#neutral)(Mediterranean salads--layered with beets, goat cheese and walnuts#neutral)",(food),"Generously garnished, organic grilled burgers are the most popular dish, but the Jerusalem market-style falafel wraps and Mediterranean salads--layered with beets, goat cheese and walnuts--are equally scrumptious."
(dining experience#negative)(waiter#positive),(anecdotes/miscellaneous),"Probably my worst dining experience in new york, and I'm a former waiter so I know what I'm talking about."
(texture#neutral)(texture#positive)(hint of cocoa#positive),(food),"Result (red velvet): Great texture, soft and velvety, nice hint of cocoa."
(round corner table next to the large window#positive),(anecdotes/miscellaneous),Ask for the round corner table next to the large window.
(twist on pizza#neutral),(food),"Their twist on pizza is heatlhy, but full of flavor."
(AC#negative),(ambience)(anecdotes/miscellaneous),The lack of AC and the fact that there are a million swarming bodies (although everyone is polite and no one is pushing) is a slight turn off.
(sales people#neutral)(service#neutral),(anecdotes/miscellaneous)(service),"I love the Little Pie Company as much as anyone else who has written reviews, but must discourage anyone from visiting the Grand Central location due to their RUDE service from two sales people."
(location#positive),(anecdotes/miscellaneous),"Unfortunately, unless you live in the neighborhood, it's not in a convenient location but is more like a hidden treasure."
(display and quality of the food#neutral),(food),Didn't seem like any effort was made to the display and quality of the food.
(food#positive),(food),The food--though mostly deep-fried--is simple and satisfying.
,(anecdotes/miscellaneous),We live in the neighborhood and have been going there twice a week since the day they first opened.
(food#neutral),(ambience)(food),"Glechik might be way too tiny for a restaurant by Russian standards, but it is cozy and the food is simply GREAT."
(food#positive)(Italian cuisine#positive)(Italian cuisine#neutral),(food),The food was excellent - authentic Italian cuisine made absolutely fresh.
(atmoshere#negative),(ambience),At night the atmoshere changes turning into this hidden jewel that is waiting to be discovered.
(place#neutral)(food#positive),(ambience)(food)(service),"The other times I've gone it's romantic date heaven, you can walk in get a booth by the windows, be treated like a VIP in a not-crowded place, with great food and service."
(coffee#positive),(food),I would only go for the coffee which is way better than Starbucks or the like.
,(anecdotes/miscellaneous),I used to be a regular costumer at pongal until dosa hut opened right next door to it.
(wine list#neutral)(wine list#negative),(food),Somewhat disappointing wine list (only new vintages.
,(anecdotes/miscellaneous),"Both were very good, but nothing you couldn't get at similar restaurant."
(priced#negative)(food#negative)(scenery#negative),(food)(price)(ambience),If your looking for nasty high priced food with a dash of ghetto scenery cheap BX A$$ this is the place to be!!
(new hamburger with special sauce#positive)(new hamburger with special sauce#positive)(big mac#positive),(food),new hamburger with special sauce is ok - at least better than big mac!
(portions#positive),(food),"Perfectly al dente pasta, not drowned in sauce -- generous portions."
(food#positive),(price)(food),"I can understand the prices if it served better food, like some Chinese restaurants in midtown/uptown area."
(Service#negative),(service)(anecdotes/miscellaneous),Service was awful - mostly because staff were overwhelmed on a Saturday night.
(owners#positive),(anecdotes/miscellaneous),"To the owners; good job guys, this place is a keeper!"
(owner#positive),(service),and the owner is simply lovely and friendly.
(place#positive)(place#positive),(ambience),This little place is wonderfully warm welcoming.
(meal#positive),(anecdotes/miscellaneous),perfect for a quick meal.
(place#positive),(ambience),Has the warmth of a family local yet it is a great place to watch sporting events.
(service#positive),(service)(price),"The service was great, and they have a whole great deal for birthdays."
(staff#neutral)(food#positive),(service)(food),The staff is 100% Italian and the food is as authentic as it gets.
(fortune cookies#negative)(cookie#negative),(anecdotes/miscellaneous),My only complaint might be the fortune cookies - I've never had a cookie predict bad luck for me before I visited Kar.
(sushi lunch#positive),(anecdotes/miscellaneous),Good for a quick sushi lunch.
(back patio#positive),(food)(ambience),Have a mojito and sit in the back patio.
(service#negative),(service),The service was dreadfully slow (the place was only half full) and a smile would have been nice...
(meal#positive)(braised lamb shank with mashed potatoes#positive)(braised lamb shank with mashed potatoes#neutral),(food),I went this past Saturday and had a excellent meal of consisting of a braised lamb shank with mashed potatoes.
(waitress#neutral)(soy sauce#neutral)(lunch#neutral),(service),The waitress came by to pick up the soy sauce WHILE we were eating our lunch!!!!!
(bar#neutral)(bartender#neutral),(service),"So we sat at the bar, the bartender didn't seem like he wanted to be there."
(fried pork dumplings#negative)(orange chicken/beef#neutral)(fried rice#negative),(food),"I reccomend the fried pork dumplings, the orange chicken/beef, and the fried rice."
(menu#neutral),(food),You will not be dissapointed by any of the choices in the menu.
(french fries -- with the kalmata dip#positive)(french fries -- with the kalmata dip#positive),(food),The french fries -- with the kalmata dip were terrific!
(wait#neutral)(manager#neutral)(bartender#neutral)(drinks#neutral),(service),"Would you ever believe that when you complain about over an hour wait, when they tell you it will be 20-30 minutes, the manager tells the bartender to spill the drinks you just paid for?"
(boutique selection of wines#negative),(food),The boutique selection of wines covers a wide variety without being imposeing.
,(ambience),"If you're lucky and there's not a private party going on back there, you'll get a chance to really chill out."
(assortment of wraps#positive)(traditional Mediterranean fare#positive),(food),They also have a great assortment of wraps if your not in the mood for traditional Mediterranean fare.
(middle eastern spreads#neutral)(middle eastern spreads#neutral)(spinach thing#positive)(lamb kebabs#positive),(food),"Fresh veggies, all sorts of middle eastern spreads, cheese and falafel, soup, fish, rice, root vegetables, a rice medley, some spinach thing, lamb kebabs, cheese baclava... soooo much fooood, and all of it delicious."
(Saketini#neutral),(food),"Disappointingly, their wonderful Saketini has been taken off the bar menu."
(look#negative),(ambience),In Short The Black Sheep distinguishes itself from the Midtown pub herd with a look that's a mix of sports-bar butch and ornate kitsch.
(martinis#positive),(food)(anecdotes/miscellaneous),I would definitely go back -- if only for some of those exotic martinis on the blackboard.
,(anecdotes/miscellaneous),They are located off the beaten path but are certainly worth the trip.
(chairs#positive)(table#positive),(service)(anecdotes/miscellaneous),then she made a fuss about not being able to add 1 or 2 chairs on either end of the table for additional people.
(happy hour#positive)(happy hour#positive),(price)(service)(ambience),"The happy hour is so cheap, but that does not reflect the service or the atmosphere."
(waiter#neutral)(kitchen#neutral)(waiting#neutral),(service),"After waiting for almost an hour, the waiter brusquely told us he'd forgotten to give the kitchen our order."
(quaility#negative)(atmosphere#negative),(ambience)(anecdotes/miscellaneous),With all the mundane or mediocre places on 8th avenue it is nice to have one that is a step above in quaility and atmosphere.
(space#negative)(treats#positive)(prices#neutral),(ambience)(food)(price),"A mix of students and area residents crowd into this narrow, barely there space for its quick, tasty treats at dirt-cheap prices."
(menu#neutral),(food)(anecdotes/miscellaneous),"Give it a try, menu is typical French but varied."
(seats#positive),(ambience)(service),It gets crowded at lunchtime but there are lots of seats in back and everyone who works there is so nice.
(value#positive),(price)(ambience),"but for the value, it was a great affordable spot to enjoy a fun night out with small group."
(attitude#positive)(attitude#positive)(food#positive),(service)(food),the negative reviews on city search are probably from jealous competing restaurants who realize they can't compete with Temple's entire positive attitude about the proper way to treat their customers and deliver top quality food.
(glass of wine#neutral),(service)(food),We ordered a glass of wine and were finished eating and paying before the wine came.
(flavors#positive),(food),"It was good, but none of the flavors WOW."
(place#positive)(place#positive)(service#positive),(service)(ambience),"Overall, this is a nice place to take a few friends to hang out at and the service is excellent."
(price#positive),(food)(price),Food is excellent quality for a good restaurant price.
,(anecdotes/miscellaneous),"Actually, everyone who worked there seemed to be annoyed."
(burrito#positive),(price)(food),"for about eleven bucks you get a gigantic burrito (or tacos), margarita, and dessert."
(space#positive),(ambience),The space is traditional in feel.
(reservations#negative),(service),"the restaurant was completely empty, but she gave me a dirty look and asked, no reservations?"
(food#negative)(interior#positive)(dining#positive),(food)(ambience)(service),the food was mediocre to be kind - the interior is small and average - the owners are a tag-team of unpleasantries - so rude and snotty i actually let out a hearty guffaw whilst dining.
(service#neutral)(food#positive)(value#positive),(service)(food)(price),"Good service, great food, good value, and never have to wait in line!"
(hot cakes#positive),(food),Offerings like hot cakes and the Egg McMuffin sandwich are available for breakfast.
(service#negative)(food#negative),(service)(food),"I have been going to this restaurant for years, in the past the service was average and the food inconsistant."
(music#neutral)(drinks#positive),(ambience)(food),"The music was fascinating, but left room for conversation, and the bartender made superb drinks."
(rice dishes#positive)(noodle dishes#positive)(ice drink#neutral),(food)(price),rice dishes and noodle dishes rarely exceed $5 and add on a refreshing ice drink for $2 and you're set for the night!
(Cuisine#neutral)(bill#neutral)(asian fusion#neutral)(billed#neutral),(price)(food),Cuisine is billed as asian fusion - doesn't meet the bill.
(dishes#neutral)(king crab salad with passion fruit vinaigrette#neutral)(fettuccine with grilled seafood in a rosemary-orange sauce#neutral)(fettuccine with grilled seafood in a rosemary-orange sauce#neutral)(bistro menu#neutral),(food),Creative dishes like king crab salad with passion fruit vinaigrette and fettuccine with grilled seafood in a rosemary-orange sauce are unexpected elements on an otherwise predictable bistro menu.
"(""Roy's Classics""#neutral)(recipes#neutral)(macadamia-crusted mahi mahi#neutral)(sweet honey-mustard beef short ribs#positive)(sweet honey-mustard beef short ribs#neutral)(sweet honey-mustard beef short ribs#positive)",(food),"Dishes denoted as ""Roy's Classics"" (marked on the menu with asterisks) are tried-and-true recipes, such as macadamia-crusted mahi mahi, or subtly sweet honey-mustard beef short ribs."
(cold sesame noodles#positive)(cold sesame noodles#negative)(cold sesame noodles#positive),(food)(price),"The cold sesame noodles, which are a freebie when you order $10+, are delectable."
(meal#positive)(food#neutral),(ambience)(food),"I came to fresh expecting a great meal, and all I got was marginally so-so food served in a restaurant that was just so freezing we couldn't enjoy eating."
(argentine chorizo appetizer#neutral)(argentine chorizo appetizer#neutral)(fennel flavored Italian sausage#neutral)(fennel flavored Italian sausage#neutral),(price)(food),The lone argentine chorizo appetizer at $8.95 was a heavy fennel flavored Italian sausage like the ones that sell for $2.99/lb at the store.
(dinner#positive),(anecdotes/miscellaneous),"I went to Swiftys with some friends of the family and we had a very nice dinner, but nothing amazing."
(value#positive)(value#positive),(service)(price)(anecdotes/miscellaneous),"Best Chinese on the Upper East, prompt delivery, good value."
(soy mayonaise#positive),(food),Most of the sandwiches are made with soy mayonaise which is actually pretty good.
(hostess#positive)(hostess#neutral),(service),i went in one day asking for a table for a group and was greeted by a very rude hostess.
(dinner#neutral),(anecdotes/miscellaneous),It's worthwhile to take a cab to Chelsea just for an awesome dinner at My Chelsea.
(food#positive)(food#positive)(staff#neutral),(food)(service),"Not only is the food authentic, but the staff here are practically off-the-boat, they are young and hip and know what they are doing when it comes to food and wine."
(music#positive)(tapas#positive)(selection of wines (primarily Spanish)#positive),(ambience)(food),"It has good music, nice tapas, an interesting selection of wines (primarily Spanish) and a lowkey hip neighborhood clientele."
(food#positive)(cold sesame noodles#negative),(food),"The food is great, I love their dumplings, cold sesame noodles, chicken and shrimp dishs."
(food#neutral)(food#neutral),(food),"And the food, well the food will keep you coming back."
(entrees#neutral)(Waiting#neutral),(service),Waiting three hours before getting our entrees was a treat as well.
(place#positive),(ambience),It's the conversations that make this a fun place to be.
(duck confitte#positive),(food),"My gf's duck confitte was very solid as well, although i have little base of reference."
(wine list#positive)(atmosphere#positive)(atmosphere#positive),(food)(ambience),"The wine list was superb, our tapas delightful, and the quiet atmosphere perfect for good conversation."
(price#positive),(food)(price),You can eat gourmet food at a fast food price.
(service#neutral)(prices#positive),(food)(service)(price),"I've eaten at all three locations and I always love, love the food, the service is always wonderful and the prices are really reasonable."
(food#positive),(food),"Not because I was pregnant, but the food here is always delicious."
(meal#positive),(food),Had a great meal there this weekend before heading to the movies!
(food#positive),(food)(service),We had a birthday party here recently and the food and service was amazing.
(entrees#positive)(seafood#positive)(steaks#positive)(non-meat alternatives#neutral),(food),"the dinner menu offers a variety of great entrees, including fresh seafood and huge steaks, there's also a couple of non-meat alternatives."
(menu#neutral)(food#positive),(food),This place has the strangest menu and the restaurants tries too hard to make fancy food.
(appetizers#neutral)(service#negative),(food)(service),"The appetizers are ok, but the service is slow."
(price#positive),(price)(food),the food - not worth the price.
(entree#negative),(service),"What can you say about a place where the waitress brings out the wrong entree, then verbally assaults your 80 year old grandmother and gives her lip about sending it back (which she did politely, by the way)."
(prices#neutral),(price),The prices are not terrible.
(bill#neutral)(gratuity#neutral),(price),15% gratuity automatically added to the bill.
(halibut cheek appetizer#positive)(portion of foie gras#positive)(portion of foie gras#neutral),(food),"The halibut cheek appetizer came with a generous portion of foie gras, but that's about the only positive thing I can say about the meal."
(Food#positive)(empenadas#positive),(food),Food is excellent and they also have empenadas and plaintains which are good for an afternoon snack.
(pasta specials#positive)(appetizer#positive),(food),Both a number of the appetizer and pasta specials were amazing.
(Filet-O-Fish sandwich#neutral)(McDonald's famous french fries#neutral)(McDonald's famous french fries#positive)(entree-sized salads#neutral),(food),"All-time favorites include the Big Mac, Chicken McNuggets, Filet-O-Fish sandwich and McDonald's famous french fries; lighter options like entree-sized salads are also available."
(noise#neutral),(ambience),"Although somewhat loud, the noise was minimally intrusive."
(pizza#negative),(ambience)(food),"It's a basic pizza joint, not much to look at, but the pizza is what I go for."
(Tables#negative),(ambience),"Tables are close, so you better be comfortable bumping elbows with other patrons."
(lunch#positive),(anecdotes/miscellaneous),Was her Monday for lunch - was working on a film in the area - and found this rare jewel.
(scene#positive),(ambience),"Not too much so, but enough that there's a great scene."
,(anecdotes/miscellaneous),You feel like you made it to New York when you eat here.
,(anecdotes/miscellaneous),We'd walked by it dozens of times and finally settled on a Monday night.
,(anecdotes/miscellaneous),"SUM IT: don't read the '10's' reviews, try it to judge for yourself so you won't have as hi expectations, then you'll be sure to enjoy it."
,(service),"We went there, no one greeted us."
(blue bar area#positive),(ambience),Dug the blue bar area too.
,(ambience),We spent so much time getting elbowed around while we waited we left.
(upstrairs dining area#neutral),(anecdotes/miscellaneous),"I got the opportunity to dine at your establishment again a few weeks ago, I was in your upstrairs dining area."
(veggie burger#positive)(vegetables#positive),(food),"Meat-phobes are in luck with the extraordinary veggie burger, made from a distinctive blend of chickpeas, carrots and other vegetables and spices."
(tables#negative),(ambience),"At peak times, the restaurant is overcrowded and tables are uncomfortably close."
(service#neutral),(service),The service was on point - what else you would expect from a Ritz?
(sweet corn-foie gras brulee#neutral)(sweet corn-foie gras brulee#positive)(sweet corn-foie gras brulee#neutral),(food),"Menus feature seasonal picks, like sweet corn-foie gras brulee."
(Carinthia cheese ravioli with wild mushrooms#positive)(Carinthia cheese ravioli with wild mushrooms#positive)(caviar-topped sturgeon#neutral)(green spinach-vodka sauce#positive)(green spinach-vodka sauce#positive),(food),"Innovations are just as assured, from the simple Carinthia cheese ravioli with wild mushrooms to the caviar-topped sturgeon, beautifully matched with a bright green spinach-vodka sauce."
(burgers#positive)(burgers#positive)(patties#positive)(patties#positive)(patties#neutral),(food),"And these are not small, wimpy fast food type burgers - these are real, full sized patties."
(delivery service#positive),(ambience)(service),"There restaurant is very casual, but perfect for lunch, and their delivery service is always very fast."
(quality#positive)(prices#neutral),(food)(price),Chinatown definitely has better quality with cheaper prices.
(staff person#neutral),(service),I had to flag down a third staff person for a fork... so now it's goodbye Little RUDE Pie Company.
,(anecdotes/miscellaneous),I have been in NYC for over 10 years and could not find this delicacy east of the Hudson .
(specials#neutral)(salmon#neutral),(food),"Go with the specials, and stay away from the salmon. "
(pastas#positive),(food),The pastas were pretty good.
(Atmosphere#neutral),(ambience),Atmosphere is a bore.
(decor#neutral),(ambience),The decor is what initially got me in the door.
(wait staff#positive),(service),The wait staff was very attentive and polite.
(food#positive),(food)(anecdotes/miscellaneous),"Great restaurant, and even greater food!"
(dishes#positive)(place#positive)(place#positive),(food)(ambience),The dishes are remarkably tasty and such a cozy and intimate place!
(desserts#positive),(food),Save room for the desserts! ;-)
(staff#neutral),(food)(service),"I love the simplicity and respect which was given to the food, as well the staff was freindly and knowledgable."
(Service#positive)(atmosphere#positive),(service)(ambience),Service was good and so was the atmosphere.
(fish#positive),(food),MY date and I both ordered the Branzini and both felt the fish was very average.
,(anecdotes/miscellaneous),We were there March 7 and found Maison very nice.
(food#positive)(service#positive)(price#positive),(food)(service)(price),"The food was good, the service prompt, and the price very reasonable. "
(menu#neutral)(service#positive),(food)(ambience)(service),"Wonderful menu, warm inviting ambiance, great service the FOOD keeps me coming back!"
(food#neutral)(wine#positive)(host#positive),(food)(service),"Great food, good wine and an excellent host."
,(anecdotes/miscellaneous),went there last night with my coworker.
(Pizzas#positive)(main courses#positive),(food),Pizzas were excellent in addition to appetizers and main courses.
(calamari#neutral)(pasta#neutral)(Sliced steak entree#neutral),(food),"Definitely try the calamari, any pasta, or even the Sliced steak entree."
(caeser salad#positive),(food),The caeser salad was great.
(fried calamari#positive)(fried calamari#negative),(food),The fried calamari was even better!
(atmosphere#positive),(ambience),The atmosphere was nice but it was a little too dark.
(food#positive),(food),The food was good overall. 
(food#positive),(food)(service),The food was outstanding and the service was tops.
(portions#positive)(service#positive),(food)(service),The portions are very large and the service is fantastic!!
(chicken milanese#negative),(food),I recomend the chicken milanese.
(tapas#positive)(tapas#positive)(prices#positive)(prices#positive)(prices#positive),(food)(price)(ambience),"excellent tapas at great prices, romantic, small but not overly crowed, excellent"
(service#negative),(service),"The service is a quite slow, but friendly."
(chocolate raspberry cake#positive),(food),"The chocolate raspberry cake is heavenly- not too sweet, but full of flavor."
(waiter#positive)(food#positive)(wine#positive),(service)(food),"Our waiter was helpful and charming, the food was perfect, and the wine was good, too."
,(ambience),Alias is warm and cozy and you don't get that squished-in feeling you get at 71 Clinton.
(MEAL#negative)(SERVICE#negative),(food)(service),I HAVE NEVER HAD A BAD MEAL(OR BAD SERVICE )@ PIGALLE.
(hot dogs#neutral)(hot dogs#positive),(food),Best hot dogs in the tri-state area.
,(anecdotes/miscellaneous),This is a typical example of an establishment in which its owners do not know anything about the restaurant business!
,(anecdotes/miscellaneous),"I would not recommend MEET at all, it is a rip off all the way from the time to step in!"
,(anecdotes/miscellaneous),Went there for a special celebration.
,(ambience),The restaurant was quiet and intimate.
(service#positive),(service),The service was very attentive and very generous.
(food#positive),(food),"We had tons of great food, wine, and desserts."
(dining experience#positive),(anecdotes/miscellaneous),Really Lovely dining experience in the midst of buzzing midtown area.
,(anecdotes/miscellaneous),"OK, I've been to Dumont a few times now."
(food#positive)(service#neutral),(food)(service),The food really isn't very good and the service is terrible.
